{
  "_type": "https://in-toto.io/Statement/v1",
  "subject": [
    {
      "name": "overlays/events.ndjson",
      "digest": {
        "sha256": "cf505b76e3689022245e2c5ad141b66804c6a1f0ee5233724d25875d5ae4cb60"
      }
    }
  ],
  "predicateType": "https://agenteval.dev/aef/1/overlay-batch",
  "predicate": {
    "schemaVersion": "1.0",
    "runId": "run-small-1",
    "runHash": "3e489b93410aeb5c050267cdb1cde3ed2dabe74b4b7b96d8a2061fc65d59b419",
    "batch": 2,
    "offset": 506,
    "length": 880,
    "previous": {
      "path": "overlays/seal-0001.json",
      "sha256": "c525b5fdadb36257e2b463f097ea16c7c784b538fd0b7902f2428dc3328566d1"
    }
  }
}
