{
  "_type": "https://in-toto.io/Statement/v1",
  "subject": [
    {
      "name": "overlays/events.ndjson",
      "digest": {
        "sha256": "f52441afd27eb11c38216887b7af2e74b7401466d5420a4d29ddffb967401756"
      }
    }
  ],
  "predicateType": "https://agenteval.dev/aef/1/overlay-batch",
  "predicate": {
    "schemaVersion": "1.0",
    "runId": "run-small-1",
    "runHash": "3e489b93410aeb5c050267cdb1cde3ed2dabe74b4b7b96d8a2061fc65d59b419",
    "batch": 1,
    "offset": 0,
    "length": 506,
    "previous": null
  }
}
