{
  "_type": "https://in-toto.io/Statement/v1",
  "subject": [
    {
      "name": "overlays/events.ndjson",
      "digest": {
        "sha256": "945473d49298082af5fd77cbc9c06f9d15e6633b9507c1de2c712aeabc9df63e"
      }
    }
  ],
  "predicateType": "https://agenteval.dev/aef/1/overlay-batch",
  "predicate": {
    "schemaVersion": "1.0",
    "runId": "01928f3e-7c1a-7b2e-9a51-3f2c0d4e8a10",
    "runHash": "f16b6a74505a359810e44611732c4d53ff61d32852983b165414811eb6a6627b",
    "batch": 2,
    "offset": 343,
    "length": 316,
    "previous": {
      "path": "overlays/seal-0001.json",
      "sha256": "8f80b91ba250eacf6c8274d2882871784063f16b41398e08bc72892641d3cb15"
    }
  }
}
